112,876,Lillia,the Bashful Bloom,Spirit Blossom Lillia,Nightbringer Lillia,,,,,,,,,,,,,,"Intensely shy, the fae fawn Lillia skittishly wanders Ionia's forests. Hiding just out of sight of mortals—whose mysterious natures have long captivated, but intimidated, her—Lillia hopes to discover why their dreams no longer reach the ancient Dreaming Tree. She now travels Ionia with a magical branch in hand, in an effort to find people's unrealized dreams. Only then can Lillia herself bloom and help others untangle their fears to find the sparkle within. Eep!",,,,,,,,,,Fighter,Mage,Mana,0,2,10,8,580.0,90,410.0,50.0,330,22,4.0,32.0,0.75,325,2.5,0.55,11.5,0.95,61.0,3.1,2.7,0.625,Blooming Blows,"Passively, Lillia gains stacking Move Speed when hitting enemies with spells. She can activate this to deal magic damage to nearby enemies, dealing extra true damage on the edge.",Watch Out! Eep!,"Lillia deals damage in a nearby area, dealing heavy damage in the center.",Swirlseed,"Lillia hurls a seed that damages and slows those it lands on. If it doesn't hit anything, it will continue rolling until it hits a wall or target.",Lilting Lullaby,Lillia causes all enemies with Dream Dust on them to become Drowsy before falling asleep. Those enemies will take extra damage on being forcibly woken up.,Dream-Laden Bough,Hitting a champion or monster with a skill will deal additional max Health damage over time.,,Lillia,,Ionia,,Dreaming Tree,,,,,,,,
113,72,Skarner,the Crystal Vanguard,Sandscourge Skarner,Earthrune Skarner,Battlecast Alpha Skarner,Guardian of the Sands Skarner,Cosmic Sting Skarner,,,,,,,,,,,"Skarner is an immense crystalline scorpion from a hidden valley in Shurima. Part of the ancient Brackern race, Skarner and his kin are known for their great wisdom and deep connection to the land, as their souls are fused with powerful life crystals which hold the living thoughts and memories of their ancestors. In an age long past, the Brackern entered hibernation to avoid untold magical destruction, but recent, threatening events have roused Skarner. As the only Brackern awake, he strives to protect his kind from those who seek to harm them.",Basic attacks reduce the cooldown of Crystal Slash. Use them as often as possible for maximum damage.,Capturing Crystal Spires before attempting neutral objectives or team fights around them improves Skarner's performance in said fights dramatically.,Impale is extremely powerful when you use it to position an enemy so your allies can attack them.,,,"Skarner can't harm you very much outside of short range, so stay away from him!","Skarner's Movement Speed is increased as long as his shield, Crystalline Exoskeleton, persists. Attack him to lower his speed.",Skarner is especially dangerous when inside Crystal Spire zones his team controls. Try to capture them ahead of time if a fight may break out around them.,,Fighter,Tank,Mana,7,6,5,5,580.0,85,320.0,60.0,335,38,3.8,32.0,1.25,125,9.0,0.85,7.2,0.45,65.0,4.5,2.1,0.625,Crystal Slash,"Skarner lashes out with his claws, dealing physical damage to all nearby enemies and charging himself with Crystal Energy for several seconds if a unit is struck. If he casts Crystal Slash again while powered by Crystal Energy, he deals bonus magic damage.",Crystalline Exoskeleton,Skarner gains a shield and has increased Movement Speed while the shield persists.,Fracture,Skarner summons a blast of crystalline energy which deals damage to enemies struck and slows them. Basic attacking these enemies within a short window will stun them.,Impale,"Skarner suppresses an enemy champion and deals damage to it. During this time, Skarner can move freely and will drag his helpless victim around with him. When the effect ends, the target will be dealt additional damage.",Crystal Spires,"Skarner's presence causes crystals to spawn in set locations around the map. Crystals can be captured by either team by standing close to them. When near crystals his team owns, Skarner gains movement speed, attack speed, and increased mana regeneration.",Shurima,Skarner,,,,,,,,,,,,
114,106,Volibear,the Relentless Storm,Thunder Lord Volibear,Northern Storm Volibear,Runeguard Volibear,Captain Volibear,El Rayo Volibear,The Thousand-Pierced Bear,Duality Dragon Volibear,Duality Dragon Volibear Prestige Edition,,,,,,,,"To those who still revere him, the Volibear is the storm made manifest. Destructive, wild, and stubbornly resolute, he existed before mortals walked the Freljord's tundra, and is fiercely protective of the lands that he and his demi-god kin created. Cultivating a deep hatred of civilization and the weakness it brought with it, he now fights to return to the old ways—when the land was untamed, and blood spilled freely—and eagerly battles all who oppose him, with tooth, claw, and thundering domination.",,,,,,,,,,Fighter,Tank,Mana,7,7,4,3,580.0,90,350.0,70.0,340,31,4.0,32.0,1.25,150,9.0,0.75,6.25,0.5,60.0,3.0,2.0,0.625,Thundering Smash,"Volibear gains speed towards enemies, <status>Stunning</status> and damaging the first one he Attacks.",Frenzied Maul,"Volibear damages an enemy, applying on-hit effects and marking them.  Casting this ability again on the same target deals bonus damage and Heals Volibear.",Sky Splitter,"Volibear summons a lightning bolt at a location, dealing damage and Slowing enemies while granting Volibear a Shield if he's inside the blast radius.",Stormbringer,"Volibear leaps to a target location, Slowing and damaging enemies beneath him while gaining bonus Health.  Enemy towers near his landing location become temporarily disabled.",The Relentless Storm,"Volibear's Attacks and abilities grant Attack Speed, and eventually cause his Attacks to deal bonus magic damage to nearby enemies.",,,,Freljord,,,,,,,,,,
115,83,Yorick,Shepherd of Souls,Undertaker Yorick,Pentakill Yorick,Arclight Yorick,Meowrick,Resistance Yorick,Pentakill III: Lost Chapter Yorick,,,,,,,,,,"The last survivor of a long-forgotten religious order, Yorick is both blessed and cursed with power over the dead. Trapped on the Shadow Isles, his only companions are the rotting corpses and shrieking spirits that he gathers to him. Yorick's monstrous actions belie his noble purpose: to free his home from the curse of the Ruination.",You do not need to cast Awakening to regain the ability to cast Last Rites.,"The Maiden will attempt to assist you in a fight, so choose your targets well.","You can send the Maiden down a lane alone, be careful though, as she represents a large portion of your combat power.",,,You can cast Smite on Mist Walkers and the Maiden of the Mist to damage or kill them.,"Try to thin out Yorick's minions before you engage him, Mist Walkers will die from a basic attack or a single target spell.",You can attack Dark Procession to break the wall down.,,Fighter,Tank,Mana,6,6,4,6,580.0,100,300.0,60.0,340,39,4.0,32.0,1.25,175,8.0,0.8,7.5,0.75,62.0,5.0,2.0,0.625,Last Rites,Yorick deals bonus damage on his next attack and heals himself. If the target dies a grave will be dug.,Dark Procession,Yorick summons a destructible wall at target location that will block enemy movement.,Mourning Mist,"Yorick throws a globule of Black Mist that damages, slows and marks enemies.",Eulogy of the Isles,Yorick summons the Maiden of the Mist that causes Yorick's attacks against the Maiden's target to deal bonus damage. The Maiden will also automatically raise Walkers from dead enemies.,Shepherd of Souls,<font color='#FF9900'>The Cursed Horde:</font> Yorick can summon Mist Walkers to swarm and attack nearby enemies.,,Yorick,,,,,,,,,,,,
116,80,Pantheon,the Unbreakable Spear,Myrmidon Pantheon,Ruthless Pantheon,Perseus Pantheon,Full Metal Pantheon,Glaive Warrior Pantheon,Dragonslayer Pantheon,Zombie Slayer Pantheon,Baker Pantheon,Pulsefire Pantheon,Ruined Pantheon,Ascended Pantheon Prestige Edition,,,,,"Once an unwilling host to the Aspect of War, Atreus survived when the celestial power within him was slain, refusing to succumb to a blow that tore stars from the heavens. In time, he learned to embrace the power of his own mortality, and the stubborn resilience that goes along with it. Atreus now opposes the divine as Pantheon reborn, his unbreakable will fueling the fallen Aspect's weapons on the field of battle.",Mortal Will activates after 5 spells or basic attacks - plan your way through fights to allow you to activate it more than once.,Whittle the enemy down with Comet Spears before you jump in.,"If an enemy is going to get out of range of your Aegis Assault, you can recast the spell to immediately fire the shield slam.",,,Pantheon's Aegis Assault makes him invulnerable from the front. Get behind him or wait it out.,Be careful near Pantheon if your health is low - a thrown Comet Spear executes low health enemies.,Grand Starfall gives several seconds of warning before Pantheon arrives. Use this time to get out of the way or to form a plan to deal with him.,,Fighter,Assassin,Mana,9,4,3,4,580.0,95,317.12,31.0,345,40,3.75,28.0,1.25,175,9.0,0.65,7.36,0.45,64.0,3.3,2.95,0.644,Comet Spear,Pantheon either thrusts his spear or throws his spear in the chosen direction.,Shield Vault,"Pantheon dashes to a target, damaging and stunning them.",Aegis Assault,"Pantheon sets his shield, becoming invulnerable to damage from the front and striking repeatedly with his spear.",Grand Starfall,"Pantheon composes himself and then leaps into the air, landing at a chosen location as a comet.",Mortal Will,"Every few spells or attacks, Pantheon's next spell is empowered.",,Pantheon,,the Aspect of War,,,,,,,Aspect,,,
117,266,Aatrox,the Darkin Blade,Justicar Aatrox,Mecha Aatrox,Sea Hunter Aatrox,Blood Moon Aatrox,Blood Moon Aatrox Prestige Edition,Victorious Aatrox,Odyssey Aatrox,,,,,,,,,"Once honored defenders of Shurima against the Void, Aatrox and his brethren would eventually become an even greater threat to Runeterra, and were defeated only by cunning mortal sorcery. But after centuries of imprisonment, Aatrox was the first to find freedom once more, corrupting and transforming those foolish enough to try and wield the magical weapon that contained his essence. Now, with stolen flesh, he walks Runeterra in a brutal approximation of his previous form, seeking an apocalyptic and long overdue vengeance.",Use Umbral Dash while casting The Darkin Blade to increase your chances of hitting the enemy.,Crowd Control abilities like Infernal Chains or your allies' immobilizing effects will help you set up The Darkin Blade.,Cast World Ender when you are sure you can force a fight.,,,"Aatrox's attacks are very telegraphed, so use the time to dodge the hit zones.",Aatrox's Infernal Chains are easier to exit when running towards the sides or at Aatrox.,Keep your distance when Aatrox uses his Ultimate to prevent him from reviving.,,Fighter,Tank,Blood Well,8,4,3,4,580.0,90,0.0,0.0,345,38,3.25,32.0,1.25,175,3.0,1.0,0.0,0.0,60.0,5.0,2.5,0.6509999999999999,The Darkin Blade,"Aatrox slams his greatsword down, dealing physical damage. He can swing three times, each with a different area of effect.",Infernal Chains,"Aatrox smashes the ground, dealing damage to the first enemy hit. Champions and large monsters have to leave the impact area quickly or they will be dragged to the center and take the damage again.",Umbral Dash,"Passively, Aatrox heals when damaging enemy champions. On activation, he dashes in a direction.",World Ender,"Aatrox unleashes his demonic form, fearing nearby enemy minions and gaining attack damage, increased healing, and movement speed. If he gets a takedown, this effect is extended.",Deathbringer Stance,"Periodically, Aatrox's next basic attack deals bonus <physicalDamage>physical damage</physicalDamage> and heals him, based on the target's max health. ",Shurima,Aatrox,,Void,,Runeterra,,,,,,,,
118,120,Hecarim,the Shadow of War,Blood Knight Hecarim,Reaper Hecarim,Headless Hecarim,Arcade Hecarim,Elderwood Hecarim,Worldbreaker Hecarim,Lancer Zero Hecarim,High Noon Hecarim,Cosmic Charger Hecarim,,,,,,,"Hecarim is a spectral fusion of man and beast, cursed to ride down the souls of the living for all eternity. When the Blessed Isles fell into shadow, this proud knight was obliterated by the destructive energies of the Ruination, along with all his cavalry and their mounts. Now, whenever the Black Mist reaches out across Runeterra, he leads their devastating charge, reveling in the slaughter and crushing the foe beneath his armored hooves.","Spirit of Dread restores Health when nearby enemies take damage, including damage dealt by allies. Cast this during a large fight to maximize Hecarim's survivability.",Devastating Charge deals more damage based on the distance traveled. Try using Onslaught of Shadows or Summoner Spells such as Ghost or Flash to maximize this damage.,,,,"Hecarim gains life from nearby enemies with Spirit of Dread but lacks durability, use burst damage.",Hecarim's ultimate causes opponents to flee in terror. Spread out to reduce his power in fights.,,,Fighter,Tank,Mana,8,6,4,6,580.0,90,277.0,60.0,345,35,4.25,32.0,1.25,175,7.0,0.75,6.5,0.6,66.0,3.2,2.5,0.67,Rampage,"Hecarim cleaves nearby enemies dealing physical damage. If Hecarim damages at least one enemy, he increases the damage and lowers the cooldown of subsequent Rampages.",Spirit of Dread,Hecarim deals magic damage to nearby enemies for a short duration. Hecarim gains Health equal to a percentage of any damage those enemies suffer.,Devastating Charge,Hecarim gains increasing Move Speed and can move through units for a short duration. His next attack knocks the target back and deals additional physical damage based on the distance he has traveled since activating the ability.,Onslaught of Shadows,"Hecarim summons spectral riders and charges forward, dealing magic damage in a line. Hecarim creates a shockwave when he finishes his charge, causing nearby enemies to flee in terror.",Warpath,Hecarim gains Attack Damage equal to a percentage of his bonus Movement Speed.,,Hecarim,,,,Runeterra,,,,,,,,
119,9,Fiddlesticks,the Ancient Fear,Spectral Fiddlesticks,Union Jack Fiddlesticks,Bandito Fiddlesticks,Pumpkinhead Fiddlesticks,Fiddle Me Timbers,Surprise Party Fiddlesticks,Dark Candy Fiddlesticks,Risen Fiddlesticks,Praetorian Fiddlesticks,,,,,,,"Something has awoken in Runeterra. Something ancient. Something terrible. The ageless horror known as Fiddlesticks stalks the edges of mortal society, drawn to areas thick with paranoia where it feeds upon terrorized victims. Wielding a jagged scythe, the haggard, makeshift creature reaps fear itself, shattering the minds of those unlucky enough to survive in its wake. Beware the sounding of the crow, or the whispering of the shape that appears <i>almost</i> human… Fiddlesticks has returned.",,,,,,,,,,Mage,Support,Mana,2,3,9,9,580.4,92,500.0,28.0,335,34,3.5,30.0,0.5,480,5.5,0.6,8.0,0.8,55.36,2.63,2.11,0.625,Terrify,"Fiddlesticks damaging enemies with spells while unseen or targeting an enemy with Terrify's activation strikes a target unit with fear, causing it to flee in terror for a duration.",Bountiful Harvest,"Fiddlesticks drains health from nearby enemies, dealing bonus execute damage at the end of the duration.",Reap,"Fiddlesticks slashes an area with its scythe, slowing all enemies hit and silencing enemies hit in the center of the slash.",Crowstorm,"A murder of crows flock wildly around Fiddlesticks, dealing damage per second to all enemy units in the area.",A Harmless Scarecrow,Fiddlesticks' trinket is replaced by scarecrow effigies.,Runeterra,,,,,,,,,,,,,
120,122,Darius,the Hand of Noxus,Lord Darius,Bioforge Darius,Woad King Darius,Dunkmaster Darius,Academy Darius,Dreadnova Darius,God-King Darius,High Noon Darius,Lunar Beast Darius,Crime City Nightmare Darius,,,,,,"There is no greater symbol of Noxian might than Darius, the nation's most feared and battle-hardened commander. Rising from humble origins to become the Hand of Noxus, he cleaves through the empire's enemies—many of them Noxians themselves. Knowing that he never doubts his cause is just, and never hesitates once his axe is raised, those who stand against the leader of the Trifarian Legion can expect no mercy.",Decimate is a powerful harassment ability. Strike an enemy from maximum range for the greatest effect.,Noxian Guillotine does more damage the more attacks you can land prior to it. Use Noxian Might to deal maximum damage.,"Darius benefits greatly from enhanced survivability. The longer you can prolong a fight, the more powerful he becomes.",,,"When Darius's axe grab is on cooldown, he is vulnerable to harassment attacks.","Darius's ability to escape from fights is limited. If you have an advantage against him, press your lead.",,,Fighter,Tank,Mana,9,5,1,2,582.0,100,263.0,57.5,340,39,4.0,32.0,1.25,175,10.0,0.95,6.6,0.35,64.0,5.0,1.0,0.625,Decimate,Darius winds up and swings his axe in a wide circle. Enemies struck by the blade take more damage than those struck by the handle. Darius heals based on enemy champions and large monsters hit by the blade.,Crippling Strike,"Darius's next attack strikes an enemy's crucial artery. As they bleed out, their Move Speed is slowed.",Apprehend,"Darius hones his axe, passively causing his physical damage to ignore a percentage of his target's Armor. When activated, Darius sweeps up his enemies with his axe's hook and pulls them to him.",Noxian Guillotine,"Darius leaps to an enemy champion and strikes a lethal blow, dealing true damage. This damage is increased for each stack of Hemorrhage on the target. If Noxian Guillotine is a killing blow, its cooldown is refreshed for a brief duration.",Hemorrhage,"Darius' attacks and damaging abilities cause enemies to bleed for physical damage over 5 seconds, stacking up to 5 times. Darius enrages and gains massive Attack Damage when his target reaches max stacks.",,,,the Trifarian Legion,,,Noxian,,,,,Noxians,,
121,53,Blitzcrank,the Great Steam Golem,Rusty Blitzcrank,Goalkeeper Blitzcrank,Boom Boom Blitzcrank,Piltover Customs Blitzcrank,Definitely Not Blitzcrank,iBlitzcrank,Riot Blitzcrank,Battle Boss Blitzcrank,Lancer Rogue Blitzcrank,Lancer Paragon Blitzcrank,Witch's Brew Blitzcrank,Space Groove Blitz & Crank,Victorious Blitzcrank,,,"Blitzcrank is an enormous, near-indestructible automaton from Zaun, originally built to dispose of hazardous waste. However, he found this primary purpose too restricting, and modified his own form to better serve the fragile people of the Sump. Blitzcrank selflessly uses his strength and durability to protect others, extending a helpful metal fist or burst of energy to subdue any troublemakers.","The 1-2-3 combo of Rocket Grab, Power Fist, and Static Field can devastate an individual opponent.",Using Blitzcrank's grab to pull an enemy into your tower range followed by a Power Fist will allow the tower to get several hits on them.,,,,Blitzcrank's passive Mana Barrier grants him a shield when he is low on health.,Staying behind creeps can prevent you from being Rocket Grabbed. Blitzcrank's Rocket Grab only pulls the first enemy target it encounters.,,,Tank,Fighter,Mana,4,8,5,4,583.0,95,267.0,40.0,325,40,3.5,32.0,1.25,125,8.5,0.75,8.5,0.8,62.0,3.5,1.13,0.625,Rocket Grab,"Blitzcrank fires his right hand to grab an opponent on its path, dealing damage and dragging it back to him.",Overdrive,Blitzcrank super charges himself to get dramatically increased Move and Attack Speed. He is temporarily slowed after the effect ends.,Power Fist,Blitzcrank charges up his fist to make his next attack deal double damage and pop his target up in the air.,Static Field,"Enemies attacked by Blitzcrank are marked and take lightning damage after 1 second. Additionally, Blitzcrank can activate this ability to remove nearby enemies' shields, damage them, and silence them briefly.",Mana Barrier,Blitzcrank gains a shield based on his mana when dropping to low health.,Zaun,Blitzcrank,,,,,,,,,,,,
122,36,Dr. Mundo,the Madman of Zaun,Toxic Dr. Mundo,Mr. Mundoverse,Corporate Mundo,Mundo Mundo,Executioner Mundo,Rageborn Mundo,TPA Mundo,Pool Party Mundo,El Macho Mundo,Frozen Prince Mundo,,,,,,"Utterly mad, tragically homicidal, and horrifyingly purple, Dr. Mundo is what keeps many of Zaun's citizens indoors on particularly dark nights. Now a self-proclaimed physician, he was once a patient of Zaun's most infamous asylum. After ""curing"" the entire staff, Dr. Mundo established his practice in the empty wards that once treated him and began mimicking the highly unethical procedures he had so often experienced himself. With a full cabinet of medicines and zero medical knowledge, he now makes himself more monstrous with each injection and terrifies the hapless ""patients"" who wander near his office.",A well-timed Sadism can bait enemy champions into attacking you even when they lack the damage to finish you.,Spirit Visage will increase the healing done by your ultimate and lower cooldowns on all of your abilities.,"Cleavers are a powerful tool for killing neutral monsters. Instead of returning to base, farm neutral monsters until your ultimate can heal you.",,,"Try to coordinate high-damage abilities with your allies right after Dr. Mundo uses his ultimate, but if you're unable to kill him quickly with burst he will heal through the damage.",Try casting Ignite when Dr. Mundo uses Sadism to negate a large portion of its healing.,,,Fighter,Tank,None,5,7,6,5,583.0,89,0.0,0.0,345,32,3.0,32.0,1.25,125,8.0,0.75,0.0,0.0,61.0,4.2,3.3,0.72,Infected Bonesaw,"Dr. Mundo throws an infected bonesaw, dealing damage to the first enemy hit based on their current health and slowing them.",Heart Zapper,"Dr. Mundo electrocutes himself, dealing persistent damage to nearby enemies and storing a portion of damage he takes. At the end of the duration or on Recast, Dr. Mundo deals a burst of damage to nearby enemies. If the burst hit an enemy, he heals a percentage of the stored damage.",Blunt Force Trauma,"Passive - Dr. Mundo gains bonus Attack Damage, increasing based on his missing Health.<br><br>Active - Dr. Mundo slams his “medical” bag into an enemy, dealing additional damage based on his missing Health. If the enemy dies they are swatted away, dealing damage to enemies they pass through.",Maximum Dosage,"Dr. Mundo pumps himself with chemicals, instantly healing a percent of his missing Health. He then gains bonus Attack Damage and Move Speed, and regenerates a portion of his maximum Health over a long duration.",Goes Where He Pleases,"Dr. Mundo resists the first Immobilizing effect that hits him, instead losing Health and dropping a chemical cannister nearby. Dr. Mundo can pick it up by walking over it, restoring Health and reducing this Ability's Cooldown.<br><br>Dr. Mundo also has significantly increased Health regeneration.<br>",,Mundo,,,,Zaun,,,,,,,,
123,238,Zed,the Master of Shadows,Shockblade Zed,SKT T1 Zed,PROJECT: Zed,Championship Zed,Death Sworn Zed,Galaxy Slayer Zed,PsyOps Zed,PROJECT: Zed Prestige Edition,,,,,,,,"Utterly ruthless and without mercy, Zed is the leader of the Order of Shadow, an organization he created with the intent of militarizing Ionia's magical and martial traditions to drive out Noxian invaders. During the war, desperation led him to unlock the secret shadow form—a malevolent spirit magic as dangerous and corrupting as it is powerful. Zed has mastered all of these forbidden techniques to destroy anything he sees as a threat to his nation, or his new order.",Saving energy and spell cooldowns until you use your ultimate will maximize Death Mark's damage.,Quickly double tapping Living Shadow will teleport Zed to his shadow immediately for rapid escapes.,Placing a Living Shadow before using Death Mark can give Zed a safe escape from combat.,,,"Zed receives bonus effect from Attack Damage items he purchases, so Armor is super effective against him.","After Zed uses his Living Shadow, he is at his most vulnerable as his damage, slow, and mobility are both dependent upon it.",Zed's Shadow Slash can only slow you if his shadow hits you with it. ,,Assassin,,Energy,9,2,1,7,584.0,85,200.0,0.0,345,32,3.5,32.0,1.25,125,7.0,0.65,50.0,0.0,63.0,3.4,3.3,0.6509999999999999,Razor Shuriken,Zed and his shadows throw their shurikens.<br><br>Each shuriken deals damage to every enemy hit.,Living Shadow,"<font color='#FF9900'>Passive:</font> Zed gains energy whenever he and his shadows strike an enemy with the same ability. Energy can only be gained once per cast ability.<br><br><font color='#FF9900'>Active:</font> Zed's shadow dashes forward, remaining in place for a few seconds. Reactivating Living Shadow will cause Zed to switch positions with this shadow.",Shadow Slash,"Zed and his shadows slash, dealing damage to nearby enemies.",Death Mark,"Zed becomes untargetable and dashes to an enemy champion, marking them. After 3 seconds the mark triggers, repeating a portion of all the damage Zed dealt to the target while they were marked.",Contempt for the Weak,Zed's basic attacks against low health targets deals bonus Magic Damage. This effect can only occur once every few seconds against the same enemy champion.,,Zed,,the Order of Shadow,,,Noxian,,,,Ionia,,,
