68,60,Elise,the Spider Queen,Death Blossom Elise,Victorious Elise,Blood Moon Elise,SKT T1 Elise,Super Galaxy Elise,Bewitching Elise,,,,,,,,,,"Elise is a deadly predator who dwells in a shuttered, lightless palace, deep within the oldest city of Noxus. Once mortal, she was the mistress of a powerful house, but the bite of a vile demigod transformed her into something beautiful, yet utterly inhuman—a spider-like creature, drawing unsuspecting prey into her web. To maintain her eternal youth, Elise now prefers to feed upon the naive and the faithless, and there are few who can resist her seductions.",Spider Form is most effective at finishing off enemies with low health; Human Form's Neurotoxin does more damage to healthy foes. ,"When in Spider Form, Spiderlings will attack the target that Elise uses Venomous Bite on. ",Elise's Spider Form and Spider Form abilities do not cost mana and can be prioritized when you are trying to conserve mana.,,,"Elise's Spider Form is more dangerous when you are at low health, and her Human Form more potent when you are at high health.",Rappel will only move Elise straight up and down unless she can descend upon an enemy unit.,Rappel has a long cooldown. Elise is vulnerable after she has used it.,,Mage,Fighter,Mana,6,5,7,9,555.0,93,324.0,50.0,330,27,4.0,30.0,0.5,550,5.5,0.6,6.0,0.8,55.0,3.0,1.75,0.625,Neurotoxin / Venomous Bite,Human Form: Deals damage based upon how high the target's Health is.<br><br>Spider Form: Lunges at an enemy and deals damage based upon how low their Health is.,Volatile Spiderling / Skittering Frenzy,Human Form: Releases a venom-gorged Spiderling that explodes when it nears a target.<br><br>Spider Form: Elise and her Spiderlings gain Attack Speed.,Cocoon / Rappel,"Human Form: Stuns the first enemy unit hit and reveals them if they are not stealthed.<br><br>Spider Form: Elise and her Spiderlings ascend into the air and then descend upon target enemy. After descending on an enemy target, Elise's bonus damage and healing from Spider Queen is increased.",Spider Form,"Transforms into a menacing spider, reducing her attack range in exchange for movement speed, new abilities, and a Spiderling swarm that will attack her foes.",Spider Queen,"Human Form: When Elise's abilities hit an enemy, she gains a dormant Spiderling.<br><br>Spider Form: Basic attacks deal bonus magic damage and restore health to Elise.",Noxus,,,,,,,,,,,,,
69,18,Tristana,the Yordle Gunner,Riot Girl Tristana,Earnest Elf Tristana,Firefighter Tristana,Guerilla Tristana,Buccaneer Tristana,Rocket Girl Tristana,Dragon Trainer Tristana,Bewitching Tristana,Omega Squad Tristana,Little Demon Tristana,Pengu Cosplay Tristana,Hextech Tristana,,,,"While many other yordles channel their energy into discovery, invention, or just plain mischief-making, Tristana was always inspired by the adventures of great warriors. She had heard much about Runeterra, its factions, and its wars, and believed her kind could become worthy of legend too. Setting foot in the world for the first time, she took up her trusty cannon Boomer, and now leaps into battle with steadfast courage and optimism.",Her massive gun allows Tristana to fire on targets at a great distance. Utilize this to prevent your enemies from ever laying a hand on you.,Use Rocket Jump after you have stacked up your Explosive Charge on an enemy to finish them off with a burst of damage.,Use Rapid Fire to help stack up your Explosive Charge on enemy champions.,,,"If you see Tristana activate Rapid Fire in a fight, stun her and try to back off until the spell dissipates.",Stand away from your creeps in a lane to take less collateral damage from Explosive Charge.,,,Marksman,Assassin,Mana,9,3,5,4,559.0,88,250.0,32.0,325,26,3.0,30.0,0.5,525,3.75,0.65,7.2,0.45,59.0,3.3,1.5,0.6559999999999999,Rapid Fire,"Tristana fires her weapon rapidly, increasing her Attack Speed for a short time.",Rocket Jump,"Tristana fires at the ground to propel her to a distant location, dealing damage and slowing surrounding units for a brief period where she lands.",Explosive Charge,"When Tristana kills a unit, her cannonballs burst into shrapnel, dealing damage to surrounding enemies. Can be activated to place a bomb on a target enemy that explodes after a short duration dealing damage to surrounding units.",Buster Shot,"Tristana loads a massive cannonball into her weapon and fires it at an enemy unit. This deals Magic Damage and knocks the target back. If the target is carrying the Explosive Charge bomb, the bomb detonation radius is doubled.",Draw a Bead,Increases Tristana's Attack Range as she levels.,Boomer,Tristana,,,,Runeterra,,,,,,,,
70,432,Bard,the Wandering Caretaker,Elderwood Bard,Snow Day Bard,Bard Bard,Astronaut Bard,,,,,,,,,,,,"A traveler from beyond the stars, Bard is an agent of serendipity who fights to maintain a balance where life can endure the indifference of chaos. Many Runeterrans sing songs that ponder his extraordinary nature, yet they all agree that the cosmic vagabond is drawn to artifacts of great magical power. Surrounded by a jubilant choir of helpful spirit meeps, it is impossible to mistake his actions as malevolent, as Bard always serves the greater good... in his own odd way.","It's important to collect chimes to improve your meep's attacks, but don't neglect your lane partner! Try to make a big entrance by bringing an ally into the lane with you with Magical Journey.",Let your Caretaker's Shrines charge up - they heal for a lot more when at full power.,"Don't forget that enemies can also use your Magical Journey doorways, and that your ultimate can also hit your allies!",,,"Bard's opponents can also travel through his Magical Journey doorways. You can follow him, if you think it's safe.",You can crush Bard's healing shrines just by walking over them. Don't let his allies take them without a fight.,"Bard's ultimate, Tempered Fate, affects allies, enemies, monsters, and turrets alike. Sometimes it can be to your advantage to jump into it!",,Support,Mage,Mana,4,4,5,9,560.0,89,350.0,50.0,330,34,4.0,30.0,0.5,500,5.5,0.55,6.0,0.45,52.0,3.0,2.0,0.625,Cosmic Binding,"Bard fires a missile which will slow the first enemy struck, and continue onward. If it strikes a wall, it will stun the initial target; if it strikes another enemy, it will stun them both.",Caretaker's Shrine,"Reveals a healing shrine which powers up over a short time, disappearing after healing and speeding up the first ally that touches it.",Magical Journey,Bard opens a portal in nearby terrain. Allies and enemies alike can take a one-way trip through that terrain by moving into the portal.,Tempered Fate,"Bard sends spirit energy arcing to a location, putting all champions, minions, monsters, and turrets hit into stasis for a brief time.",Traveler's Call,"<font color='#FF9900'>Meeps:</font> Bard attracts lesser spirits that assist with his basic attacks to deal extra magic damage. When Bard has collected enough  <font color='#cccc00'>Chimes</font>, his meeps will also deal damage in an area and slow enemies hit.<br><br><font color='#FF9900'>Chimes:</font> Ancient <font color='#cccc00'>chimes</font> randomly appear for Bard to collect. These grant experience, restore mana, and provide out of combat Move Speed.",,Bard,,,,,Runeterrans,,,,,,,
71,25,Morgana,the Fallen,Exiled Morgana,Sinful Succulence Morgana,Blade Mistress Morgana,Blackthorn Morgana,Ghost Bride Morgana,Victorious Morgana,Lunar Wraith Morgana,Bewitching Morgana,Majestic Empress Morgana,Coven Morgana,Dawnbringer Morgana,Bewitching Morgana Prestige Edition,,,,"Conflicted between her celestial and mortal natures, Morgana bound her wings to embrace humanity, and inflicts her pain and bitterness upon the dishonest and the corrupt. She rejects laws and traditions she believes are unjust, and fights for truth from the shadows of Demacia—even as others seek to repress it—by casting shields and chains of dark fire. More than anything else, Morgana truly believes that even the banished and outcast may one day rise again.",Shrewd use of Black Shield can determine the outcome of team fights.,Items that provide survivability allow Morgana to become extremely difficult to kill in conjunction with Black Shield and Soul Shackles.,Tormented Shadow is an excellent farming tool if you're by yourself in a lane.,,,"Tormented Shadow deals tons of damage to units missing large amounts of Health. When low on Health, be wary of Morgana's attempts to trap you within its reach.",Morgana often needs to land Dark Binding to setup her other attacks. Use your minions as shields against Dark Binding.,"Black Shield makes Morgana immune to disabling effects, but can be broken with magic damage.",,Mage,Support,Mana,1,6,8,1,560.0,90,340.0,60.0,335,25,3.8,30.0,0.5,450,5.5,0.4,11.0,0.4,56.0,3.5,1.53,0.625,Dark Binding,"Morgana binds an enemy in place with dark magic, forcing them to feel the pain they've caused and dealing magic damage. ",Tormented Shadow,"Morgana casts a cursed shadow on an area, damaging enemies who dare stand in her dark circle. They receive magic damage over time, which increases the lower health they are.",Black Shield,"Morgana anoints an ally with a protective barrier of starfire, which absorbs magical damage and disabling effects until it is broken.",Soul Shackles,"Morgana unleashes the full force of her Celestial power as she unbinds her wings and hovers above the ground. She lashes chains of dark pain onto nearby enemy champions, gaining Move Speed towards them. The chains slow and deal initial damage and, after a delay, stun those who are unable to break them.",Soul Siphon,"Morgana drains spirit from her enemies, healing as she deals damage to champions, large minions, and medium and larger jungler monsters.",,Morgana,,Demacia,,,,,,,,,,
72,92,Riven,the Exile,Redeemed Riven,Crimson Elite Riven,Battle Bunny Riven,Championship Riven,Dragonblade Riven,Arcade Riven,Championship Riven 2016,Dawnbringer Riven,Pulsefire Riven,Valiant Sword Riven,Valiant Sword Riven Prestige Edition,Spirit Blossom Riven,Sentinel Riven,,,"Once a swordmaster in the warhosts of Noxus, Riven is an expatriate in a land she previously tried to conquer. She rose through the ranks on the strength of her conviction and brutal efficiency, and was rewarded with a legendary runic blade and a warband of her own. However, on the Ionian front, Riven's faith in her homeland was tested and ultimately broken. Having severed all ties to the empire, she now seeks to find her place in a shattered world, even as rumors abound that Noxus itself has been reforged...","Riven's Broken Wings locks onto the champion your cursor is over at the time of cast. If you want to move past your opponent, make sure that your cursor is past your opponent as well.","Riven lacks a source of healing or strong defense and must compensate with burst combos. Lead into fights with Broken Wings and Ki Burst, while using Valor to escape and absorb counter-harass.",,,,Riven has a great deal of mobility but she cannot move very far with any one skill. Rooting or silencing her during her combo will greatly reduce her effectiveness.,"All of Riven's damage is physical, prioritize high Armor if an opposing Riven gets out of control.","Riven excels at dueling multiple melee attackers at once, as she will be on an almost equal footing damage-wise. If pairing up against Riven, don't go in as double melee until she has expended her full combo.",,Fighter,Assassin,None,8,5,1,8,560.0,86,0.0,0.0,340,33,3.2,32.0,1.25,125,8.5,0.5,0.0,0.0,64.0,3.0,3.5,0.625,Broken Wings,Riven lashes out in a series of strikes. This ability can be reactivated three times in a short time frame with the third hit knocking back nearby enemies.,Ki Burst,"Riven emits a Ki Burst, damaging and stunning nearby enemies.",Valor,Riven steps forward a short distance and blocks incoming damage.,Blade of the Exile,"Riven empowers her keepsake weapon with energy, and gains Attack Damage and Range. During this time, she also gains the ability to use Wind Slash, a powerful ranged attack, once.",Runic Blade,"Riven's abilities charge her blade, and her basic attacks expend charges to deal an additional damage.",Noxus,Riven,,,,,Ionian,,,,,,,
73,142,Zoe,the Aspect of Twilight,Cyber Pop Zoe,Pool Party Zoe,Star Guardian Zoe,Arcanist Zoe,Arcanist Zoe Prestige Edition,,,,,,,,,,,"As the embodiment of mischief, imagination, and change, Zoe acts as the cosmic messenger of Targon, heralding major events that reshape worlds. Her mere presence warps the arcane mathematics governing realities, sometimes causing cataclysms without conscious effort or malice. This perhaps explains the breezy nonchalance with which Zoe approaches her duties, giving her plenty of time to focus on playing games, tricking mortals, or otherwise amusing herself. An encounter with Zoe can be joyous and life affirming, but it is always more than it appears and often extremely dangerous.",Paddle Star deals more damage the further it has flown. Casting it behind yourself before redirecting can deal tons of damage.,"Break Sleep with your biggest damage source, since enemies who are asleep take double damage.",Sleepy Trouble Bubble travels further over walls. Find a hiding spot to set up for a long distance kill.,,,Zoe's Paddle Star deals more damage the further it has flown.,"Zoe must return to her starting point after casting Portal Jump, making her vulnerable to a counterattack.",Sleepy Trouble Bubble travels further over walls. Stop Zoe from hiding in fog of war to prevent her from setting the spell up.,,Mage,Support,Mana,1,7,8,5,560.0,92,425.0,25.0,340,21,3.5,30.0,0.5,550,6.5,0.6,8.0,0.65,58.0,3.3,2.5,0.625,Paddle Star!,Zoe fires a missile that she can redirect in flight. Deals more damage the longer it flies in a straight line.,Spell Thief,"Zoe can pick up the remnants of enemy summoner spell and active item casts and cast them once herself. Whenever she casts a summoner spell, she gains 3 missiles that fire at the nearest target.",Sleepy Trouble Bubble,"Causes the target to become drowsy, then fall asleep. The first source of damage that breaks the sleep is doubled, up to a cap.",Portal Jump,Blink to a nearby position for 1 second. Then blink back.,More Sparkles!,Zoe's next basic attack after casting a spell deals bonus magic damage.,,Zoe,,Targon,,,,,,,,,,
74,166,Akshan,the Rogue Sentinel,Cyber Pop Akshan,,,,,,,,,,,,,,,"Raising an eyebrow in the face of danger, Akshan fights evil with dashing charisma, righteous vengeance, and a conspicuous lack of shirts. He is highly skilled in the art of stealth combat, able to evade the eyes of his enemies and reappear when they least expect him. With a keen sense of justice and a legendary death-reversing weapon, he rights the wrongs of Runeterra's many scoundrels while living by his own moral code: “Don't be an ass.”","Raising an eyebrow in the face of danger, Akshan fights evil with dashing charisma, righteous vengeance, and a conspicuous lack of shirts. He is highly skilled in the art of stealth combat, able to evade the eyes of his enemies and reappear when they least expect him. With a keen sense of justice and a legendary death-reversing weapon, he rights the wrongs of Runeterra's many scoundrels while living by his own moral code: “Don't be an ass.”",,,,,,,,,Marksman,Assassin,Mana,0,0,0,0,560.0,90,350.0,40.0,330,26,3.0,30.0,0.5,500,3.75,0.65,8.175,0.7,52.0,3.5,4.0,0.638,Avengerang,"Akshan throws a boomerang that deals damage going out and coming back, extending its range each time it hits an enemy.",Going Rogue,"Akshan passively marks enemy champions as Scoundrels when they kill his ally champions. If Akshan kills a Scoundrel, he resurrects the allies they killed, gains bonus gold, and clears all marks.<br><br>When activated, Akshan enters camouflage and gains Move Speed and Mana Regen while moving towards Scoundrels. Akshan loses the camouflage quickly while he is not in brush or near terrain.",Heroic Swing,"Akshan fires a grappling hook into terrain then swings around it, repeatedly firing at the nearest enemy while swinging. He can jump off early or gets knocked off when colliding with champions or terrain.",Comeuppance,"Akshan locks onto an enemy champion and starts storing bullets. When released, he fires all stored bullets, dealing damage based on missing health to the first champion, minion, or structure hit.",Dirty Fighting,"Every three hits from Akshan's Attacks and Abilities deals bonus damage and grants him a Shield if the target was a champion.<br><br>When Akshan Attacks, he fires an additional Attack for reduced damage. If he cancels the additional Attack, he instead gains Move Speed.",,Akshan,,,,Runeterra,,,,,,,,
75,69,Cassiopeia,the Serpent's Embrace,Desperada Cassiopeia,Siren Cassiopeia,Mythic Cassiopeia,Jade Fang Cassiopeia,Eternum Cassiopeia,Spirit Blossom Cassiopeia,Coven Cassiopeia,,,,,,,,,"Cassiopeia is a deadly creature bent on manipulating others to her sinister will. Youngest and most beautiful daughter of the noble Du Couteau family of Noxus, she ventured deep into the crypts beneath Shurima in search of ancient power. There, she was bitten by a gruesome tomb guardian, whose venom transformed her into a viper-like predator. Cunning and agile, Cassiopeia now slithers under the veil of night, petrifying her enemies with her baleful gaze.",Use Twin Fang on poisoned stationary targets like monsters and units stunned by her Petrifying Gaze for maximum damage.,Lead your enemy when targeting with Noxious Blast to ensure the hit.,,,,Be wary of Cassiopeia's damage potential with Twin Fang when she has you poisoned.,Turn away from Cassiopeia when she is casting Petrifying Gaze to get slowed instead of stunned.,,,Mage,,Mana,2,3,9,10,560.0,90,350.0,60.0,328,18,3.5,32.0,0.5,550,5.5,0.5,8.0,0.8,53.0,3.0,1.5,0.647,Noxious Blast,"Cassiopeia blasts an area with Poison after a brief delay, granting her increased Move Speed if she hits an enemy champion.",Miasma,"Cassiopeia releases several clouds of poison, slowing, grounding, and lightly damaging enemies that pass through them. Grounded enemies cannot use Movement abilities.",Twin Fang,"Cassiopeia lets loose an attack that deals increased damage to Poisoned targets and heals her for a percentage of the damage dealt. If the target dies from this attack, Cassiopeia regains Mana.",Petrifying Gaze,"Cassiopeia releases a swirl of magical energy from her eyes, stunning any enemies in front of her that are facing her and slowing any others with their back turned.",Serpentine Grace,"Cassiopeia gains Move Speed per level, but she cannot purchase Boots items.",Noxus,Du Couteau,Shurima,Youngest,,Cassiopeia,,,,,,,,
76,126,Jayce,the Defender of Tomorrow,Full Metal Jayce,Debonair Jayce,Forsaken Jayce,Jayce Brighthammer,Battle Academia Jayce,Resistance Jayce,Arcane Jayce,,,,,,,,,"Jayce is a brilliant inventor who has pledged his life to the defense of Piltover and its unyielding pursuit of progress. With his transforming hextech hammer in hand, Jayce uses his strength, courage, and considerable intelligence to protect his hometown. While revered throughout the city as a hero, he hasn't taken well to the attention heroism brings. Still, Jayce's heart is in the right place, and even those who envy his natural skills are grateful for his protection in the City of Progress.",Be sure to switch stances often. It will enhance your attacks and grant you quick bursts of speed.,"If you find yourself taking lots of damage, try using Jayce's Hammer Stance, as it grants you additional defenses.","For increased range and damage, try casting Shock Blast through the Acceleration Gate.",,,Jayce can attack in melee or at range. Pay attention to his stance and weapon color to know how he is going to attack.,"If you see Jayce drop his Acceleration Gate, be careful, he is probably about to cast Shock Blast.","Jayce is strong in the early game. If he gains the advantage, play defensively.",,Fighter,Marksman,Mana,8,4,3,7,560.0,90,375.0,45.0,335,27,3.5,30.0,0.5,125,6.0,0.6,6.0,0.8,54.0,4.25,3.0,0.6579999999999999,To the Skies! / Shock Blast,Hammer Stance: Leaps to an enemy dealing physical damage and slowing enemies.<br><br>Cannon Stance: Fires an orb of electricity that detonates upon hitting an enemy (or reaching the end of its path) dealing physical damage to all enemies hit.,Lightning Field / Hyper Charge,"Hammer Stance: Passive: Restores Mana per strike. Active: Creates a field of lightning damaging nearby enemies for several seconds.<br><br>Cannon Stance: Gains a burst of energy, increasing Attack Speed to maximum for several attacks.",Thundering Blow / Acceleration Gate,"Hammer Stance: Deals magic damage to an enemy and knocks them back a short distance.<br><br>Cannon Stance: Deploys an Acceleration Gate increasing the Move Speed of all allied champions who pass through it. If Shock Blast is fired through the gate the missile speed, range, and damage will increase.",Mercury Cannon / Mercury Hammer,Hammer Stance: Transforms the Mercury Hammer into the Mercury Cannon gaining new abilities and increased range. The first attack in this form reduces the target's Armor and Magic Resist.<br><br>Cannon Stance: Transforms the Mercury Cannon into the Mercury Hammer gaining new abilities and increasing Armor and Magic Resist. The first attack in this form deals additional magic damage.,Hextech Capacitor,When Jayce swaps weapons he gains movement speed for a short duration.,Piltover,Jayce,the City of Progress,,,,,,,,,,,
77,234,Viego,The Ruined King,Lunar Beast Viego,Dissonance of Pentakill Viego,,,,,,,,,,,,,,"Once ruler of a long-lost kingdom, Viego perished over a thousand years ago when his attempt to bring his wife back from the dead triggered the magical catastrophe known as the Ruination. Transformed into a powerful, unliving wraith tortured by an obsessive longing for his centuries-dead queen, Viego now stands as the Ruined King, controlling the deadly Harrowings as he scours Runeterra for anything that might one day restore her, and destroying all in his path as the Black Mist pours endlessly from his cruel, broken heart.",,,,,,,,,,Assassin,Fighter,None,6,4,2,5,560.0,95,0.0,0.0,345,34,4.0,32.0,1.25,200,7.0,0.7,0.0,0.0,57.0,3.5,2.5,0.6579999999999999,Blade of the Ruined King,"Viego's spectral blade passively deals bonus percent current Health damage <OnHit>On-Hit</OnHit> and strikes twice vs. enemies he recently hit with an Ability, stealing Health.<br><br>Viego can activate this Ability to thrust his zweihander forward, impaling enemies in front of him.",Spectral Maw,"Viego charges up before dashing forward, releasing a ball of concentrated Black Mist that stuns the first enemy hit.",Harrowed Path,"Viego commands the Black Mist to haunt and surround a piece of terrain. Viego can hide in the Mist as a wraith, gaining camouflage, Move Speed, and Attack Speed.",Heartbreaker,"Viego teleports to a nearby location and executes an enemy champion on arrival, piercing their heart and causing a destructive shockwave around them that knocks away their allies.",Sovereign's Domination,"Enemies who fall before Viego become wraiths. By attacking a wraith, Viego temporarily seizes control of the dead enemy's body, healing for a percentage of his target's max health and gaining access to their basic abilities and items. He replaces their Ultimate with a free cast of his own.",the Black Mist,Viego,,the Ruined King,,Harrowings,,Runeterra,,,,,,
78,113,Sejuani,Fury of the North,Sabretusk Sejuani,Darkrider Sejuani,Traditional Sejuani,Bear Cavalry Sejuani,Poro Rider Sejuani,Beast Hunter Sejuani,Sejuani Dawnchaser,Firecracker Sejuani,Hextech Sejuani,PROJECT: Sejuani,,,,,,"Sejuani is the brutal, unforgiving Iceborn warmother of the Winter's Claw, one of the most feared tribes of the Freljord. Her people's survival is a constant, desperate battle against the elements, forcing them to raid Noxians, Demacians, and Avarosans alike to survive the harsh winters. Sejuani herself spearheads the most dangerous of these attacks from the saddle of her drüvask boar Bristle, using her True Ice flail to freeze and shatter her enemies.","Use Arctic Assault to escape bad situations, interupt channeled spells or chase runners.","Melee allies can stack Frost for your Permafrost, keep an eye on who they are attacking.",Save Glacial Prison for encounters where you have teammates present to take advantage of it.,,,Dodging Arctic Assault and Glacial Prison can give you a huge advantage.,Focus on avoiding the second swing of Winter's Wrath which carries the brunt of the damage.,"Melee enemies can also stack Frost for Sejuani, be very careful around them.",,Tank,Fighter,Mana,5,7,6,4,560.0,100,400.0,40.0,340,34,4.25,32.0,1.25,150,8.5,1.0,7.0,0.7,66.0,4.0,3.5,0.688,Arctic Assault,"Sejuani charges forward, knocking enemies into the air. The charge stops after hitting an enemy champion.",Winter's Wrath,"Sejuani swings her mace twice, dealing damage, slowing enemies and applying Frost stacks.",Permafrost,Sejuani freezes and stuns an enemy champion that has maximum Frost stacks.,Glacial Prison,Sejuani throws her bola that freezes and stuns the first champion hit and creates an ice storm that slows other enemies.,Fury of the North,"After being out of combat, Sejuani gains Frost Armor which grants Armor and Magic Resist and immunity to slows. Frost Armor persists for a short time after Sejuani takes damage.  Sejuani can damage a stunned enemy to shatter it, dealing massive magic damage.",Bristle,Sejuani,,Claw,,,Noxians,,,,Freljord,Demacians,Avarosans,
