33,17,Teemo,the Swift Scout,Happy Elf Teemo,Recon Teemo,Badger Teemo,Astronaut Teemo,Cottontail Teemo,Super Teemo,Panda Teemo,Omega Squad Teemo,Little Devil Teemo,Beemo,Spirit Blossom Teemo,Spirit Blossom Teemo Prestige Edition,,,,"Undeterred by even the most dangerous and threatening of obstacles, Teemo scouts the world with boundless enthusiasm and a cheerful spirit. A yordle with an unwavering sense of morality, he takes pride in following the Bandle Scout's Code, sometimes with such eagerness that he is unaware of the broader consequences of his actions. Though some say the existence of the Scouts is questionable, one thing is for certain: Teemo's conviction is nothing to be trifled with.",Teemo's mushrooms can be used to farm creep waves very effectively.,"Place your mushrooms at key locations on the map, such as by the Dragon or Baron Nashor, to reveal when your enemies might be attempting to kill them.",,,,"Teemo's Toxic Shot punishes players who get hit and back out, so stay at a safe range until you're ready to commit.",It can be valuable to use Oracle's Lens(Trinket) to destroy mushrooms around key locations.,,,Marksman,Assassin,Mana,5,3,7,6,528.0,90,334.0,20.0,330,24,3.75,30.0,0.5,500,5.5,0.65,9.6,0.45,54.0,3.0,3.38,0.69,Blinding Dart,"Obscures an enemy's vision with a powerful venom, dealing damage to the target unit and blinding it for the duration.",Move Quick,"Teemo scampers around, passively increasing his Move Speed until he is struck by an enemy champion or turret. Teemo can sprint to gain bonus Move Speed that isn't stopped by being struck for a short time.",Toxic Shot,"Each of Teemo's attacks will poison the target, dealing damage on impact and each second after for 4 seconds.",Noxious Trap,"Teemo throws an explosive poisonous trap using one of the mushrooms stored in his pack. If an enemy steps on the trap, it will release a poisonous cloud, slowing enemies and damaging them over time. If Teemo throws a mushroom onto another mushroom it will bounce, gaining additional range.",Guerrilla Warfare,"If Teemo stands still and takes no actions for a short duration, he becomes Invisible indefinitely. If he's in brush, Teemo can enter and maintain his Invisibility while moving. After leaving Invisibility, Teemo gains the Element of Surprise, increasing his Attack Speed for a few seconds.",the Bandle Scout's Code,,,Scouts,,,,,,,,,,
34,81,Ezreal,the Prodigal Explorer,Nottingham Ezreal,Striker Ezreal,Frosted Ezreal,Explorer Ezreal,Pulsefire Ezreal,TPA Ezreal,Debonair Ezreal,Ace of Spades Ezreal,Arcade Ezreal,Star Guardian Ezreal,SSG Ezreal,Pajama Guardian Ezreal,Battle Academia Ezreal,PsyOps Ezreal,PsyOps Ezreal Prestige Edition,"A dashing adventurer, unknowingly gifted in the magical arts, Ezreal raids long-lost catacombs, tangles with ancient curses, and overcomes seemingly impossible odds with ease. His courage and bravado knowing no bounds, he prefers to improvise his way out of any situation, relying partially on his wits, but mostly on his mystical Shuriman gauntlet, which he uses to unleash devastating arcane blasts. One thing is for sure—whenever Ezreal is around, trouble isn't too far behind. Or ahead. Probably everywhere.",Use Arcane Shift to help line up your other skill shots.,You can play Ezreal either as a Attack Damage carry or Ability Power carry depending on how you build him.,You can line up Trueshot Barrage to hit multiple minion waves or even Monsters.,,,Ezreal is a very fragile champion so take the fight to him.,"Ezreal is completely skill shot based, so make sure to keep minions in between you.",Mystic Shot applies on-hit effects including the Crest of Cinders.,,Marksman,Mage,Mana,7,2,6,7,530.0,88,375.0,70.0,325,24,3.5,30.0,0.5,550,4.0,0.65,8.5,0.65,60.0,2.5,2.5,0.625,Mystic Shot,Ezreal fires a damaging bolt of energy which reduces all of his cooldowns slightly if it strikes an enemy unit.,Essence Flux,"Ezreal fires an orb that sticks to the first champion or objective hit. If Ezreal hits an enemy with the orb, it detonates and deals damage.",Arcane Shift,Ezreal teleports to a target nearby location and fires a homing bolt which strikes the nearest enemy unit. Prioritizes enemies stuck with Essence Flux.,Trueshot Barrage,Ezreal winds up before firing a powerful barrage of energy that deals massive damage to each unit it passes through (damage is reduced for minions and non-epic monsters).,Rising Spell Force,"Ezreal gains increasing Attack Speed each time he successfully hits a spell, stacking up to 5 times.",,Ezreal,,,,,Shuriman,,,,,,,
35,412,Thresh,the Chain Warden,Deep Terror Thresh,Championship Thresh,Blood Moon Thresh,SSW Thresh,Dark Star Thresh,High Noon Thresh,Pulsefire Thresh,Pulsefire Thresh Prestige Edition,FPX Thresh,Spirit Blossom Thresh,Unbound Thresh,Steel Dragon Thresh,,,,"Sadistic and cunning, Thresh is an ambitious and restless spirit of the Shadow Isles. Once the custodian of countless arcane secrets, he was undone by a power greater than life or death, and now sustains himself by tormenting and breaking others with slow, excruciating inventiveness. His victims suffer far beyond their brief mortal coil as Thresh wreaks agony upon their souls, imprisoning them in his unholy lantern to torture for all eternity.",Communication is key when making use of Thresh's lantern. Let your teammates know how you like to use it.,Death Sentence and Flay can be combined in either cast order for powerful combinations.,Thresh can collect souls without needing to kill units himself. Planning your map position to be near the most deaths will help to maximize soul collection.,,,Thresh's Death Sentence has a long cast time. Watch for the cast to begin to take evasive actions.,Intentionally breaking a wall of The Box can allow a vulnerable ally to escape unscathed.,Thresh relies on collecting souls for a portion of his defense and damage. Try punishing him when he moves to collect them.,,Support,Fighter,Mana,5,6,6,7,530.0,95,274.0,44.0,330,28,0.0,30.0,0.5,450,7.0,0.55,6.0,0.8,56.0,2.2,3.5,0.625,Death Sentence,Thresh binds an enemy in chains and pulls them toward him. Activating this ability a second time pulls Thresh to the enemy.,Dark Passage,Thresh throws out a lantern that shields nearby allied Champions from damage. Allies can click the lantern to dash to Thresh.,Flay,"Thresh's attacks wind up, dealing more damage the longer he waits between attacks. When activated, Thresh sweeps his chain, knocking all enemies hit in the direction of the blow.",The Box,A prison of walls that slow and deal damage if broken.,Damnation,"Thresh can harvest the souls of enemies that die near him, permanently granting him Armor and Ability Power.",,Thresh,,,,,,,,,,,,
36,523,Aphelios,the Weapon of the Faithful,Nightbringer Aphelios,Lunar Beast Aphelios,,,,,,,,,,,,,,"Emerging from moonlight's shadow with weapons drawn, Aphelios kills the enemies of his faith in brooding silence—speaking only through the certainty of his aim, and the firing of each gun. Though fueled by a poison that renders him mute, he is guided by his sister Alune. From her distant temple sanctuary, she pushes an arsenal of moonstone weapons into his hands. For as long as the moon shines overhead, Aphelios will never be alone.","Each of Aphelios' weapons have different strengths, so try to find the right situation for your current weapons. ",,,,,"Each of Aphelios' weapons have different weaknesses, try to exploit the ones that work best for your champion. Watch out for the purple Gravity gun, it can root you.",,,,Marksman,,Mana,6,2,1,10,530.0,88,348.0,42.0,325,28,3.0,30.0,0.5,550,3.25,0.55,6.5,0.4,55.0,3.0,2.1,0.64,Weapon Abilites,"Aphelios has 5 different activated abilities, based on his main-hand weapon:<br><br>Calibrum (Rifle): Long range shot that marks its target for a long-range follow-up attack.<br>Severum (Scythe Pistol): Run fast while attacking nearby enemies with both weapons.<br>Gravitum (Cannon): Root all enemies slowed by this weapon.<br>Infernum (Flamethrower): Blast enemies in a cone and attack them with your off-hand weapon.<br>Crescendum (Chakram): Deploy a sentry that shoots your off-hand weapon.<br>",Phase,"Aphelios swaps his main-hand gun with his off-hand gun, replacing his basic attack and activated ability.",Weapon Queue System,Aphelios has no third ability. This slot shows the next weapon Alune will give him. Weapon order begins fixed but may change over game time -- when a weapon is out of ammo it goes to the end of the order.,Moonlight Vigil,Fire a concentrated blast of moonlight that explodes on enemy champions. Applies the unique effect of Aphelios' main-hand gun.,The Hitman and the Seer,"Aphelios wields 5 Lunari Weapons made by his sister Alune. He has access to two at a time: one main-hand and one off-hand. Each weapon has a unique Basic Attack and Ability. Attacks and abilities consume a weapon's ammo. When out of ammo, Aphelios discards the weapon and Alune summons the next of the 5. ",,Aphelios,,,moonlight,,,,,,,,,
37,61,Orianna,the Lady of Clockwork,Gothic Orianna,Sewn Chaos Orianna,Bladecraft Orianna,TPA Orianna,Winter Wonder Orianna,Heartseeker Orianna,Dark Star Orianna,Victorious Orianna,Pool Party Orianna,,,,,,,"Once a curious girl of flesh and blood, Orianna is now a technological marvel comprised entirely of clockwork. She became gravely ill after an accident in the lower districts of Zaun, and her failing body had to be replaced with exquisite artifice, piece by piece. Accompanied by an extraordinary brass sphere she built for companionship and protection, Orianna is now free to explore the wonders of Piltover, and beyond.",Command: Protect can be used on yourself to return the Ball back to you quickly. Combine this with Command: Attack for a quick harassment.,Command: Dissonance is a very powerful escape tool if Orianna has the Ball. The combination of speed and leaving a slowing obstacle can be quite powerful.,Command: Shockwave can be used to drag enemies towards you or away from you if you position the Ball properly.,,,Orianna can only affect the area the Ball is around. Use this to your advantage.,Watch out for Orianna's Ball returning to her due to leashing. This may cause some unexpected situations.,,,Mage,Support,Mana,4,3,9,7,530.0,91,418.0,25.0,325,17,3.0,26.0,0.5,525,7.0,0.55,8.0,0.8,40.0,2.6,3.5,0.6579999999999999,Command: Attack,"Orianna commands her Ball to fire toward a target location, dealing magic damage to targets along the way (deals less damage to subsequent targets). Her Ball remains at the target location after.",Command: Dissonance,"Orianna commands her Ball to release a pulse of energy, dealing magic damage around it. This leaves a field behind that speeds up allies and slows enemies.",Command: Protect,"Orianna commands her Ball to attach to an allied champion, Shielding them and dealing magic damage to any enemies it passes through on the way. Additionally, the Ball grants additional Armor and Magic Resist to the champion it is attached to.",Command: Shockwave,"Orianna commands her Ball to unleash a shockwave, dealing magic damage and launching nearby enemies towards the Ball after a short delay.",Clockwork Windup,Orianna's Attacks deal additional magic damage. This damage increases the more Orianna Attacks the same target.,Zaun,Orianna,Piltover,,,,,,,,,,,
38,360,Samira,the Desert Rose,PsyOps Samira,Space Groove Samira,,,,,,,,,,,,,,"Samira stares death in the eye with unyielding confidence, seeking thrill wherever she goes. After her Shuriman home was destroyed as a child, Samira found her true calling in Noxus, where she built a reputation as a stylish daredevil taking on dangerous missions of the highest caliber. Wielding black-powder pistols and a custom-engineered blade, Samira thrives in life-or-death circumstances, eliminating any who stand in her way with flash and flair.",,,,,,,,,,Marksman,,Mana,8,5,3,6,530.0,88,348.88,38.0,335,26,3.0,30.0,0.5,500,3.25,0.55,8.18,0.7,57.0,3.0,3.3,0.6579999999999999,Flair,"Samira fires a shot or swings her sword, dealing damage. If cast during Wild Rush, strike all enemies in her path upon completion.",Blade Whirl,"Samira slashes around her, damaging enemies and destroying enemy missiles.",Wild Rush,"Samira dashes through an enemy (including structures), slashing enemies she passes through and gaining Attack Speed. Killing an enemy champion refreshes this ability's cooldown.",Inferno Trigger,"Samira unleashes a torrent of shots from her weapons, wildly shooting all enemies surrounding her.",Daredevil Impulse,"Samira builds a combo by hitting attacks or abilities unique from the previous hit. Samira's attacks in melee range deal additional magic damage. Samira's attacks against enemies affected by <status>Immobilizing</status> effects will dash her to her attack range. If the enemy is <status>Knocked Up</status>, she also keeps them <status>Knocked Up</status> briefly.",Noxus,Samira,,,,,Shuriman,,,,,,,
39,110,Varus,the Arrow of Retribution,Blight Crystal Varus,Arclight Varus,Arctic Ops Varus,Heartseeker Varus,Varus Swiftbolt,Dark Star Varus,Conqueror Varus,Infernal Varus,PROJECT: Varus,Cosmic Hunter Varus,,,,,,"One of the ancient darkin, Varus was a deadly killer who loved to torment his foes, driving them almost to insanity before delivering the killing arrow. He was imprisoned at the end of the Great Darkin War, but escaped centuries later in the remade flesh of two Ionian hunters—they had unwittingly released him, cursed to bear the bow containing his bound essence. Varus now seeks out those who trapped him, in order to enact his brutal vengeance, but the mortal souls within still resist him every step of the way.",An early point in Blighted Quiver helps harass enemy champions and get killing blows on minions.,"During short range fights it's sometimes best to fire Piercing Arrow quickly, rather than charging it to full power.",Try to take advantage of Piercing Arrow's very long range to snipe at enemy champions before a fight or as they're trying to flee.,,,"If you are affected by Blight, Varus' abilities will deal extra damage to you.","When he gets a kill or assist, Varus temporarily gains Attack Speed and is much more dangerous.","You'll get bound in place if a tendril from Varus' ultimate, Chain of Corruption, reaches you. You can cause the tendril to die however by running far enough away from it.",,Marksman,Mage,Mana,7,3,4,2,530.0,91,360.0,40.0,330,27,3.4,30.0,0.5,575,3.5,0.55,8.0,0.8,59.0,3.4,4.0,0.6579999999999999,Piercing Arrow,Varus readies and then fires a powerful shot that gains extra range and damage the longer he spends preparing to fire.,Blighted Quiver,"Passive: Varus' basic attacks deal bonus magic damage and apply Blight. Varus' other abilities detonate Blight, dealing magic damage based on the target's maximum Health. Active: Varus empowers his next Piercing Arrow.",Hail of Arrows,Varus fires a hail of arrows that deal physical damage and desecrate the ground. Desecrated ground slows enemies' Movement Speed and reduces their self healing and regeneration.,Chain of Corruption,"Varus flings out a damaging tendril of corruption that immobilizes the first enemy champion hit and then spreads towards nearby uninfected champions, immobilizing them too on contact.",Living Vengeance,"On kill or assist, Varus temporarily gains Attack Speed. This bonus is larger if the enemy is a champion.",,Varus,,,,,Ionian,,the Great Darkin War,,,,,
40,112,Viktor,the Machine Herald,Full Machine Viktor,Prototype Viktor,Creator Viktor,Death Sworn Viktor,PsyOps Viktor,,,,,,,,,,,"The herald of a new age of technology, Viktor has devoted his life to the advancement of humankind. An idealist who seeks to lift the people of Zaun to a new level of understanding, he believes that only by embracing a glorious evolution of technology can humanity's full potential be realized. With a body augmented by steel and science, Viktor is zealous in his pursuit of this bright future.",Death Ray is a powerful poke and a strong area of denial tool. Use it in combination with Gravity Field to control your enemy's position.,Make sure you choose the right augment at the right time.,,,,Be careful about how close you let Viktor get to you. Viktor's control of the battlefield increases with his proximity to his opponent.,"Be aware of how many augments Viktor has upgraded by looking at the color of the light on his staff (purple, yellow, blue, red).",,,Mage,,Mana,2,4,10,9,530.0,90,405.0,45.0,335,23,4.0,30.0,0.5,525,8.0,0.65,8.0,0.8,53.0,3.0,2.11,0.6579999999999999,Siphon Power,"Viktor blasts an enemy unit dealing magic damage, gaining a shield and empowering his next basic attack.<br><br>Augment: Siphon Power's shield is increased by 60% and Viktor gains bonus Movement Speed after casting.",Gravity Field,Viktor conjures a heavy gravitational field that slows enemies in its radius. Enemies who stay within the device for too long are stunned.<br><br>Augment: Viktor's non-periodic spells apply a slow to enemies.,Death Ray,"Viktor uses his robotic arm to fire a chaos beam that cuts across the field in a line, dealing damage to all enemies in its path.<br><br>Augment: An explosion follows the Death Ray's wake, dealing magic damage.",Chaos Storm,Viktor conjures a singularity on the field which deals magic damage and interrupts enemy channels. The singularity then periodically does magic damage to all nearby enemies. Viktor can redirect the singularity.<br><br>Augment: The Chaos Storm moves 25% faster.,Glorious Evolution,Viktor can augment his basic abilities when he gets kills on enemies.,,Viktor,,,,Zaun,,,,,,,,
41,163,Taliyah,the Stoneweaver,Freljord Taliyah,SSG Taliyah,Pool Party Taliyah,,,,,,,,,,,,,"Taliyah is a nomadic mage from Shurima, torn between teenage wonder and adult responsibility. She has crossed nearly all of Valoran on a journey to learn the true nature of her growing powers, though more recently she has returned to protect her tribe. Some have mistaken her compassion for weakness and paid the ultimate price—for beneath Taliyah's youthful demeanor is a will strong enough to move mountains, and a spirit fierce enough to make the earth itself tremble.",Try to throw enemies into Unraveled Earth using Seismic Shove.,"Remember, you don't always have to ride Weaver's Wall.","Once you have Rylai's Crystal Scepter, casting Threaded Volley at enemies chasing you is a great way of making them regret everything.",,,"When Taliyah casts Unraveled Earth in the lane, be on the lookout for Seismic Shove. If she throws you into her minefield, the throws and stones will break your bones.","Taliyah's Threaded Volley is locked into a direction. If she's throwing rocks at you, dodge to the side!",,,Mage,Support,Mana,1,7,8,5,532.0,90,425.0,30.0,335,20,3.5,30.0,0.5,525,7.0,0.7,9.34,0.85,58.0,3.3,1.36,0.625,Threaded Volley,"Taliyah throws a volley of missiles in a target direction, moving freely as she does. This works the ground below her. If Taliyah casts Threaded Volley on worked ground, she only throws one missile.",Seismic Shove,Taliyah causes an area of ground to erupt and throws enemies within in a direction of her choosing.,Unraveled Earth,Taliyah creates a slowing minefield that explodes if enemies dash through it or are pushed/pulled through it.,Weaver's Wall,Taliyah creates a very long wall and then surfs it.,Rock Surfing,Taliyah gains movement speed near walls.,Shurima,Taliyah,,,,,,,,,,,,
42,133,Quinn,Demacia's Wings,Phoenix Quinn,Woad Scout Quinn,Corsair Quinn,Heartseeker Quinn,Warden Quinn,,,,,,,,,,,"Quinn is an elite ranger-knight of Demacia, who undertakes dangerous missions deep in enemy territory. She and her legendary eagle, Valor, share an unbreakable bond, and their foes are often slain before they realize they are fighting not one, but two of the kingdom's greatest heroes. Nimble and acrobatic when required, Quinn takes aim with her crossbow while Valor marks their elusive targets from above, making them a deadly pair on the battlefield.",Attacking a ,Vulnerable, target marked by Valor will put Harrier on cooldown. Quickly consuming Harrier marks will allow you to generate them faster.,"Vault is powerful but must be used with caution, as enemies can attack Quinn when she strikes them. Vault can sometimes be used to cross terrain if your back is to a wall.","Use Behind Enemy Lines for traveling very long distances quickly, for farming minions around the map, or for chasing wounded targets.","After being marked, move away from Quinn so she can't take advantage of it.",Keep tabs on Quinn's position. Behind Enemy Lines can enable Valor to cross the map very quickly and attack you by surprise.,"When Quinn is using Behind Enemy Lines, damaging her removes her movement speed bonus temporarily.",,Marksman,Assassin,Mana,9,4,2,5,533.0,85,269.0,35.0,335,28,3.5,30.0,0.5,525,5.5,0.55,6.97,0.4,59.0,2.4,3.1,0.6679999999999999,Blinding Assault,Quinn calls Valor to mark an enemy and hinder its vision before damaging all enemies in the immediate area.,Heightened Senses,Passively grants Quinn Attack Speed and Movement Speed after she attacks a <font color='#FFF673'>Vulnerable</font> target. Activate to have Valor reveal a large area nearby.,Vault,"Quinn dashes to an enemy, dealing physical damage and slowing the target's Movement Speed. Upon reaching the target, she leaps off the target, briefly interrupting it, and lands near her maximum Attack Range away from the target.",Behind Enemy Lines,"Quinn and Valor team up to fly around at great speed.  Ending the ability casts Skystrike, which deals damage to nearby enemies and marks champions as Vulnerable.",Harrier,"Valor, Quinn's Demacian eagle, periodically marks enemies as <font color='#FFF673'>Vulnerable</font>. Quinn's first basic attack against <font color='#FFF673'>Vulnerable</font> targets will deal bonus physical damage.",,Quinn,,Valor,,Demacia,,,,,,,,
43,43,Karma,the Enlightened One,Sun Goddess Karma,Sakura Karma,Traditional Karma,Order of the Lotus Karma,Warden Karma,Winter Wonder Karma,Conqueror Karma,Dark Star Karma,Dawnbringer Karma,Odyssey Karma,Ruined Karma,Tranquility Dragon Karma,,,,"No mortal exemplifies the spiritual traditions of Ionia more than Karma. She is the living embodiment of an ancient soul reincarnated countless times, carrying all her accumulated memories into each new life, and blessed with power that few can comprehend. She has done her best to guide her people in recent times of crisis, though she knows that peace and harmony may come only at a considerable cost—both to her, and to the land she holds most dear.",Gathering Fire rewards aggressive play. Look to land abilities and basic attacks on your opponent to lower Mantra's cooldown and stay on the offensive.,"When using Focused Resolve, slow your opponents with Inner Flame or speed yourself up with Inspire if you're having trouble sticking to a target. ","Don't be too conservative with Mantra. Gathering Fire is strongest in teamfights, making it easy to recharge Mantra multiple times.",,,Karma's passive lowers her Mantra cooldown when she hits enemy champions with abilities and basic attacks. Deny her from getting free hits on you.,Karma's Soulflare erupts for bonus damage in the area in which it's placed. React quickly and escape the circle to avoid taking heavy damage.,Focused Resolve is a strong disengage tool. Create distance to avoid being rooted and seek to engage afterwards.,,Mage,Support,Mana,1,7,8,5,534.0,95,374.0,50.0,335,28,3.8,30.0,0.5,525,5.5,0.55,13.0,0.5,51.0,3.3,2.3,0.625,Inner Flame,"Karma sends forth a ball of spirit energy that explodes and deals damage upon hitting an enemy unit.<br><br>Mantra Bonus: In addition to the explosion, Mantra increases the destructive power of her Inner Flame, creating a cataclysm which deals damage after a short delay.",Focused Resolve,"Karma creates a tether between herself and a targeted enemy, dealing damage and revealing them. If the tether is not broken, the enemy will be rooted and damaged again.<br><br>Mantra Bonus: Karma strengthens the link, healing herself and extending the root duration.",Inspire,"Karma summons a protective shield that absorbs incoming damage and increases the Move Speed of the protected ally.<br><br>Mantra Bonus: Energy radiates out from her target, strengthening the initial shield and applying Inspire to nearby allied champions.",Mantra,Karma empowers her next ability to do an additional effect. Mantra is available at level 1 and does not require a skill point.,Gathering Fire,Attacks and abilities on enemy champions reduce Mantra's cooldown.,,Karma,,Ionia,,,,,,,,,,
